{
  "ruleId": "tiered-corp-eur",
  "description": "Corporate operating account, tiered. 0–1M: 2.00%; 1–10M: 3.00%; 10M+: 3.50%. act/360, simple, monthly posting.",
  "currency": "EUR",
  "kind": "tiered",
  "dayCount": "act/360",
  "ratePolicy": {
    "type": "tiered",
    "tiers": [
      { "upTo": "1000000000000000000000000", "bps": 200 },
      { "upTo": "10000000000000000000000000", "bps": 300 },
      { "upTo": "max", "bps": 350 }
    ]
  },
  "compounding": "none",
  "postingFrequency": "monthly",
  "metadata": {
    "kgRef": "paycodex/concepts/account-tier.md"
  }
}
